{
  "schemaVersion": 1,
  "datasetId": "san11.ps2-historical.inventory.20261007",
  "evidence": "public-guide-transcription",
  "executionEnabled": false,
  "observationCount": 64,
  "eventCount": 64,
  "clauseCount": 741,
  "coverageCounts": {
    "conditions-only": 4,
    "conditions-and-results": 59,
    "reference-only": 1
  },
  "continuationOnlyResultObservationIds": [
    "ps2.atwiki100.08",
    "ps2.atwiki100.40"
  ],
  "sourceIndependence": "not-established",
  "source": {
    "sourceId": "atwiki-100-ps2",
    "url": "https://w.atwiki.jp/sangokushi11/pages/100.html",
    "title": "史実イベント（PS2）",
    "retrievedUTC": "2026-10-07",
    "displayedLastUpdated": "2010-03-09 16:52; timezone not stated",
    "toolFreshness": "Crawled: last month; not a live origin freshness certificate",
    "snapshotFile": "atwiki-100-ps2-rendered-lines.txt",
    "snapshotSha256": "f1ab94d5e25170370285523cd90ab212099e4bd8515c00faffa2641e57fac40e",
    "snapshotFormat": "web-rendered-text-normalized-line-boundaries-not-raw-html",
    "selectionStartLine": 116,
    "selectionEndLine": 1061,
    "bodyStartLine": 191,
    "bodyEndLine": 1061,
    "commentsIncluded": false,
    "colorInformationRetained": false,
    "expectedObservationCount": 64
  },
  "catalog": [
    {
      "eventId": "ps2.historical.01",
      "observationId": "ps2.atwiki100.01",
      "sourceOrdinal": 1,
      "sourceSection": "黄巾の乱",
      "sourceLocator": {
        "startLine": 191,
        "endLine": 195
      },
      "coverageKind": "conditions-only",
      "clauseCount": 2,
      "reviewedObservationSha256": "34188d92f2a810f0b00b4acd232ecab2590af33c945bc92551c96666fbd32d5b"
    },
    {
      "eventId": "ps2.historical.02",
      "observationId": "ps2.atwiki100.02",
      "sourceOrdinal": 2,
      "sourceSection": "桃園の誓い",
      "sourceLocator": {
        "startLine": 196,
        "endLine": 200
      },
      "coverageKind": "conditions-only",
      "clauseCount": 2,
      "reviewedObservationSha256": "b055b181442da16fa2438c106c0e27538c882577d5bbc880947cafcc00e6e2ba"
    },
    {
      "eventId": "ps2.historical.03",
      "observationId": "ps2.atwiki100.03",
      "sourceOrdinal": 3,
      "sourceSection": "少帝廃立",
      "sourceLocator": {
        "startLine": 201,
        "endLine": 211
      },
      "coverageKind": "conditions-and-results",
      "clauseCount": 8,
      "reviewedObservationSha256": "e59fe68cc10b6557e2ac9e24a90d3b883ba35a31cc55673f3b6936014b0bd331"
    },
    {
      "eventId": "ps2.historical.04",
      "observationId": "ps2.atwiki100.04",
      "sourceOrdinal": 4,
      "sourceSection": "反董卓連合",
      "sourceLocator": {
        "startLine": 212,
        "endLine": 215
      },
      "coverageKind": "conditions-only",
      "clauseCount": 2,
      "reviewedObservationSha256": "857c8b807546b474cb4c882d6eae4c5338e3017d04569860cb647e33e32ac92a"
    },
    {
      "eventId": "ps2.historical.05",
      "observationId": "ps2.atwiki100.05",
      "sourceOrdinal": 5,
      "sourceSection": "長安遷都",
      "sourceLocator": {
        "startLine": 216,
        "endLine": 245
      },
      "coverageKind": "conditions-and-results",
      "clauseCount": 29,
      "reviewedObservationSha256": "d891f4c76412d0a93155654578b69b38ae577c0f5c2198c81032971b3efd7a93"
    },
    {
      "eventId": "ps2.historical.06",
      "observationId": "ps2.atwiki100.06",
      "sourceOrdinal": 6,
      "sourceSection": "反董卓連合崩壊",
      "sourceLocator": {
        "startLine": 246,
        "endLine": 256
      },
      "coverageKind": "conditions-and-results",
      "clauseCount": 8,
      "reviewedObservationSha256": "b60ac9db4c891cfc15fe4cf804af0917859450076942dab5366f9c348d06c38b"
    },
    {
      "eventId": "ps2.historical.07",
      "observationId": "ps2.atwiki100.07",
      "sourceOrdinal": 7,
      "sourceSection": "連環の計①酒宴",
      "sourceLocator": {
        "startLine": 257,
        "endLine": 268
      },
      "coverageKind": "conditions-and-results",
      "clauseCount": 10,
      "reviewedObservationSha256": "0ffa35f6e6f29d3de048622be1eb3fad1f19d6374fb25f2fc81be4c1bf80f6ff"
    },
    {
      "eventId": "ps2.historical.08",
      "observationId": "ps2.atwiki100.08",
      "sourceOrdinal": 8,
      "sourceSection": "連環の計②鳳儀亭",
      "sourceLocator": {
        "startLine": 269,
        "endLine": 275
      },
      "coverageKind": "conditions-and-results",
      "clauseCount": 5,
      "reviewedObservationSha256": "a51152346d6c8337610c17d960b49100da21d27647d496aba1775f0c455c0cea"
    },
    {
      "eventId": "ps2.historical.09",
      "observationId": "ps2.atwiki100.09",
      "sourceOrdinal": 9,
      "sourceSection": "連環の計③謀殺",
      "sourceLocator": {
        "startLine": 276,
        "endLine": 302
      },
      "coverageKind": "conditions-and-results",
      "clauseCount": 26,
      "reviewedObservationSha256": "8b86bfc784f8938954a26e9a19170fedb3545c24ff2f820ca56dc3bdf1920759"
    },
    {
      "eventId": "ps2.historical.10",
      "observationId": "ps2.atwiki100.10",
      "sourceOrdinal": 10,
      "sourceSection": "虎を追うもの",
      "sourceLocator": {
        "startLine": 303,
        "endLine": 313
      },
      "coverageKind": "conditions-and-results",
      "clauseCount": 9,
      "reviewedObservationSha256": "7bf8843f7d5381d612419874c40bc685b4fd8382097f20d356a9f495d4f79aed"
    },
    {
      "eventId": "ps2.historical.11",
      "observationId": "ps2.atwiki100.11",
      "sourceOrdinal": 11,
      "sourceSection": "悪来対許褚",
      "sourceLocator": {
        "startLine": 314,
        "endLine": 329
      },
      "coverageKind": "conditions-and-results",
      "clauseCount": 14,
      "reviewedObservationSha256": "f5ecc6b8cdc27b90d0e6ab2b88eaf9a49a65634083cd868255a69d3f43b72315"
    },
    {
      "eventId": "ps2.historical.12",
      "observationId": "ps2.atwiki100.12",
      "sourceOrdinal": 12,
      "sourceSection": "荀彧、郭嘉を推挙す",
      "sourceLocator": {
        "startLine": 330,
        "endLine": 340
      },
      "coverageKind": "conditions-and-results",
      "clauseCount": 8,
      "reviewedObservationSha256": "bf7aaf1c107f4b932d0afa1530cc1b42cbac29376812607953fce784530f032c"
    },
    {
      "eventId": "ps2.historical.13",
      "observationId": "ps2.atwiki100.13",
      "sourceOrdinal": 13,
      "sourceSection": "郭嘉、劉曄を推挙す",
      "sourceLocator": {
        "startLine": 341,
        "endLine": 351
      },
      "coverageKind": "conditions-and-results",
      "clauseCount": 9,
      "reviewedObservationSha256": "5ef313d3a5ef8d6ed1559e35fa83c07e0386a04e0f8369e8769439b424697eaa"
    },
    {
      "eventId": "ps2.historical.14",
      "observationId": "ps2.atwiki100.14",
      "sourceOrdinal": 14,
      "sourceSection": "劉曄、満寵・呂虔を推挙す",
      "sourceLocator": {
        "startLine": 352,
        "endLine": 362
      },
      "coverageKind": "conditions-and-results",
      "clauseCount": 9,
      "reviewedObservationSha256": "2d640f7330544a2fdb2c8eb2b1bfbc2115e864f7908d185eeaeaff190cf46484"
    },
    {
      "eventId": "ps2.historical.15",
      "observationId": "ps2.atwiki100.15",
      "sourceOrdinal": 15,
      "sourceSection": "曹嵩惨殺",
      "sourceLocator": {
        "startLine": 363,
        "endLine": 374
      },
      "coverageKind": "conditions-and-results",
      "clauseCount": 10,
      "reviewedObservationSha256": "b069a93bca23cbe2a695e6f6fd0c305ae073be42fe10e7472a68a596ee41eff6"
    },
    {
      "eventId": "ps2.historical.16",
      "observationId": "ps2.atwiki100.16",
      "sourceOrdinal": 16,
      "sourceSection": "徐州禅譲",
      "sourceLocator": {
        "startLine": 375,
        "endLine": 386
      },
      "coverageKind": "conditions-and-results",
      "clauseCount": 10,
      "reviewedObservationSha256": "2888d018786290912f698a5209510a990aef65d08338776eb90bf47213d81c1d"
    },
    {
      "eventId": "ps2.historical.17",
      "observationId": "ps2.atwiki100.17",
      "sourceOrdinal": 17,
      "sourceSection": "糜氏と劉備（結婚）",
      "sourceLocator": {
        "startLine": 387,
        "endLine": 400
      },
      "coverageKind": "conditions-and-results",
      "clauseCount": 12,
      "reviewedObservationSha256": "8813a2ee3aeeacded754d85393cdafab0e1b69d991742f169246a2eae68d4fc4"
    },
    {
      "eventId": "ps2.historical.18",
      "observationId": "ps2.atwiki100.18",
      "sourceOrdinal": 18,
      "sourceSection": "許昌遷都",
      "sourceLocator": {
        "startLine": 401,
        "endLine": 413
      },
      "coverageKind": "conditions-and-results",
      "clauseCount": 10,
      "reviewedObservationSha256": "fd4851e8ff5ff13aa06ac0221db8c56c9284ddeaba009d8cf16d3ff1bc749442"
    },
    {
      "eventId": "ps2.historical.19",
      "observationId": "ps2.atwiki100.19",
      "sourceOrdinal": 19,
      "sourceSection": "孫策出陣",
      "sourceLocator": {
        "startLine": 414,
        "endLine": 418
      },
      "coverageKind": "conditions-only",
      "clauseCount": 2,
      "reviewedObservationSha256": "0ff29f2df8c6d08a5c53a7546448eac53d21aa741fb5aecbdf396bf3dbd1dd0e"
    },
    {
      "eventId": "ps2.historical.20",
      "observationId": "ps2.atwiki100.20",
      "sourceOrdinal": 20,
      "sourceSection": "小覇王孫策",
      "sourceLocator": {
        "startLine": 419,
        "endLine": 427
      },
      "coverageKind": "conditions-and-results",
      "clauseCount": 7,
      "reviewedObservationSha256": "9c477ed3294324b8ddc254e47987a1a520f4c69c06e8adfd9eea7a1ea43bee0a"
    },
    {
      "eventId": "ps2.historical.21",
      "observationId": "ps2.atwiki100.21",
      "sourceOrdinal": 21,
      "sourceSection": "二張推挙",
      "sourceLocator": {
        "startLine": 428,
        "endLine": 446
      },
      "coverageKind": "conditions-and-results",
      "clauseCount": 18,
      "reviewedObservationSha256": "cf661ebdfbac05435c5eb2642b9eddeb412f2d239bb5815aff075fe864b93374"
    },
    {
      "eventId": "ps2.historical.22",
      "observationId": "ps2.atwiki100.22",
      "sourceOrdinal": 22,